{
  "required" : true ,
  "$schema" : "http://json-schema.org/draft-03/schema" ,
  "type" : "object" ,
  "properties" : {
    "id" : {
      "type" : "string" ,
      "required" : false
    } ,
    "user" : {
      "type" : "object" ,
      "required" : false ,
      "properties" : {
        "name" : {
          "type" : "string" ,
          "required" : false
        } ,
        "id" : {
          "type" : "string" ,
          "required" : false
        }
      }
    } ,
    "application" : {
      "type" : "object" ,
      "required" : false ,
      "properties" : {
        "name" : {
          "type" : "string" ,
          "required" : false
        } ,
        "namespace" : {
          "type" : "string" ,
          "required" : false
        } ,
        "id" : {
          "type" : "string" ,
          "required" : false
        }
      }
    } ,
    "actions" : {
      "type" : "array" ,
      "required" : false ,
      "items" : [
        {
          "type" : "object" ,
          "properties" : {
            "type" : {
              "type" : "string" ,
              "required" : false
            } ,
            "status" : {
              "type" : "string" ,
              "required" : false
            } ,
            "currency" : {
              "type" : "string" ,
              "required" : false
            } ,
            "amount" : {
              "type" : "string" ,
              "required" : false
            } ,
            "time_created" : {
              "type" : "string" ,
              "required" : false
            } ,
            "time_updated" : {
              "type" : "string" ,
              "required" : false
            }
          }
        }
      ]
    } ,
    "refundable_amount" : {
      "type" : "object" ,
      "required" : false ,
      "properties" : {
        "currency" : {
          "type" : "string" ,
          "required" : false
        } ,
        "amount" : {
          "type" : "string" ,
          "required" : false
        }
      }
    } ,
    "items" : {
      "type" : "array" ,
      "required" : false ,
      "items" : [
        {
          "type" : "object" ,
          "properties" : {
            "type" : {
              "type" : "string" ,
              "required" : false
            } ,
            "product" : {
              "type" : "string" ,
              "required" : false
            } ,
            "quantity" : {
              "type" : "number" ,
              "required" : false
            }
          }
        }
      ]
    } ,
    "country" : {
      "type" : "string" ,
      "required" : false
    } ,
    "request_id" : {
      "type" : "string" ,
      "required" : false
    } ,
    "created_time" : {
      "type" : "string" ,
      "required" : false
    } ,
    "payout_foreign_exchange_rate" : {
      "type" : "number" ,
      "required" : false
    } ,
    "disputes" : {
      "type" : "array" ,
      "required" : false ,
      "items" : [
        {
          "type" : "object" ,
          "properties" : {
            "user_comment" : {
              "type" : "string" ,
              "required" : false
            } ,
            "time_created" : {
              "type" : "string" ,
              "required" : false
            } ,
            "user_email" : {
              "type" : "string" ,
              "required" : false
            } ,
            "status" : {
              "type" : "string" ,
              "required" : false
            } ,
            "reason" : {
              "type" : "string" ,
              "required" : false
            }
          }
        }
      ]
    }
  }
}