{
  "id" : "519180411528475" ,
  "user" : {
    "name" : "Marco Alvarez" ,
    "id" : "500535225"
  } ,
  "application" : {
    "name" : "Friend Smash!" ,
    "namespace" : "friendsmashsample" ,
    "id" : "241431489326925"
  } ,
  "actions" : [
    {
      "type" : "charge" ,
      "status" : "completed" ,
      "currency" : "EUR" ,
      "amount" : "0.80" ,
      "time_created" : "2014-02-12T00:49:38+0000" ,
      "time_updated" : "2014-02-12T00:49:38+0000"
    } , {
      "type" : "refund" ,
      "status" : "completed" ,
      "currency" : "EUR" ,
      "amount" : "0.80" ,
      "time_created" : "2014-02-12T02:33:30+0000" ,
      "time_updated" : "2014-02-12T02:33:30+0000"
    }
  ] ,
  "refundable_amount" : {
    "currency" : "EUR" ,
    "amount" : "0.00"
  } ,
  "items" : [
    {
      "type" : "IN_APP_PURCHASE" ,
      "product" : "http://www.friendsmash.com/og/coins.html" ,
      "quantity" : 10
    }
  ] ,
  "country" : "US" ,
  "request_id" : "ISgQj4vGrrnmhGyABL5IaRmeUAoYlL2BrMoMOnmbsFj7AxrNurHej3jeZZS3710k" ,
  "created_time" : "2014-02-12T00:49:38+0000" ,
  "payout_foreign_exchange_rate" : 1.343826 ,
  "disputes" : [
    {
      "user_comment" : "I didn't get my Friend Smash coin! Please help!" ,
      "time_created" : "2014-02-12T01:37:27+0000" ,
      "user_email" : "mail@domain.com" ,
      "status" : "resolved" ,
      "reason" : "refunded_in_cash"
    }
  ]
}